{
  "schema": "urn:ai-friends:schema:agent:v1:tool-cancel",
  "request_id": "6f1d2c3b-4a59-4b8c-9d0e-1f2a3b4c5d6e",
  "trace_id": "a1b2c3d4e5f60718a1b2c3d4e5f60718",
  "requested_at": "2026-08-30T10:00:03Z",
  "requested_by": { "kind": "human", "id": "human:op-a1b2" },
  "reason": "supervisor",
  "mode": "cooperative",
  "note": "Оператор остановил выполнение до подтверждения результата."
}
